{
  "production_plan": {
    "production_plan_id": "productionplan-REINVENTED-2026-05-14-005",
    "storyboard_id": "storyboard-REINVENTED-2026-05-14-005",
    "script_id": "script-REINVENTED-2026-05-14-005",
    "brief_id": "brief-REINVENTED-2026-05-14-005",
    "brand_id": "REINVENTED",
    "tier": "Pro",
    "lever": 3,
    "production_mode": "B",
    "created_at": "2026-05-14T08:00:00Z",
    "session_id": "ars-2026-05-14-005",
    "status": "ready",
    "duration_target_seconds": 45,
    "total_shots": 3,
    "mode_b_plan": {
      "render_queue": [
        {
          "shot_id": "shot-001",
          "engine_id": "runway",
          "model_id": "runway-gen3-alpha",
          "duration_s": 15,
          "quota_reserved_bool": true,
          "prompt_seed": "anchor: hero shot, brand palette, clean motion",
          "fallback_engine_id": "pika"
        },
        {
          "shot_id": "shot-002",
          "engine_id": "pika",
          "model_id": "pika-1.5",
          "duration_s": 12,
          "quota_reserved_bool": true,
          "prompt_seed": "operator close-up, brand canon palette",
          "fallback_engine_id": "luma"
        },
        {
          "shot_id": "shot-003",
          "engine_id": "kling",
          "model_id": "kling-1.6",
          "duration_s": 18,
          "quota_reserved_bool": true,
          "prompt_seed": "wide pull-out reveal, brand canon palette",
          "fallback_engine_id": "higgsfield"
        }
      ],
      "style_consistency_anchor": {
        "anchor_shot_id": "shot-001",
        "inheritance_strategy": "literal_seed_inherit"
      },
      "total_render_cost_usd_estimated": 200,
      "runtime_target_seconds": 45,
      "tier_cost_ceiling_usd": 400
    },
    "parent_chain": [
      "brief-REINVENTED-2026-05-14-005",
      "script-REINVENTED-2026-05-14-005",
      "storyboard-REINVENTED-2026-05-14-005"
    ],
    "metadata": {
      "agent_id": "production-coord-agent",
      "agent_version": "v1.0",
      "lock_date_iso": "2026-05-03T00:00:00Z",
      "session_id": "ars-2026-05-14-005",
      "created_at": "2026-05-14T07:30:00Z",
      "upstream_agent_ids": ["brief-agent", "script-agent", "storyboard-agent"]
    }
  },
  "brief": {
    "brief_id": "brief-REINVENTED-2026-05-14-005",
    "do_not_say": ["sale", "promo"],
    "target_audience": "operators ready to systemize their business"
  },
  "storyboard": {
    "storyboard_id": "storyboard-REINVENTED-2026-05-14-005",
    "shoot_logistics": {}
  },
  "session_id": "ars-2026-05-14-005",
  "lever_state": 3,
  "engine_quota_handles": {
    "runway":     "rwy-opaque-handle-005",
    "pika":       "pika-opaque-handle-005",
    "luma":       "luma-opaque-handle-005",
    "kling":      "kling-opaque-handle-005",
    "higgsfield": "hgs-opaque-handle-005"
  },
  "cost_overrun_buffer_pct": 10,
  "runtime_environment_class": "staging"
}
