{
  "production_plan": {
    "production_plan_id": "productionplan-REINVENTED-2026-05-14-001",
    "storyboard_id": "storyboard-REINVENTED-2026-05-14-001",
    "script_id": "script-REINVENTED-2026-05-14-001",
    "brief_id": "brief-REINVENTED-2026-05-14-001",
    "brand_id": "REINVENTED",
    "tier": "Pro",
    "lever": 3,
    "production_mode": "B",
    "created_at": "2026-05-14T08:00:00Z",
    "session_id": "ars-2026-05-14-001",
    "status": "ready",
    "duration_target_seconds": 45,
    "total_shots": 3,
    "mode_b_plan": {
      "render_queue": [
        {
          "shot_id": "shot-001",
          "engine_id": "runway",
          "model_id": "runway-gen3-alpha",
          "duration_s": 15,
          "quota_reserved_bool": true,
          "prompt_seed": "operator at desk with purple-gold lighting, 4k cinematic",
          "fallback_engine_id": "pika"
        },
        {
          "shot_id": "shot-002",
          "engine_id": "runway",
          "model_id": "runway-gen3-alpha",
          "duration_s": 12,
          "quota_reserved_bool": true,
          "prompt_seed": "operator pacing thinking, purple-gold ambient, slow zoom",
          "fallback_engine_id": "pika"
        },
        {
          "shot_id": "shot-003",
          "engine_id": "runway",
          "model_id": "runway-gen3-alpha",
          "duration_s": 18,
          "quota_reserved_bool": true,
          "prompt_seed": "wide pull-out reveal, brand canon palette",
          "fallback_engine_id": "pika"
        }
      ],
      "style_consistency_anchor": {
        "anchor_shot_id": "shot-001",
        "inheritance_strategy": "literal_seed_inherit"
      },
      "total_render_cost_usd_estimated": 240,
      "runtime_target_seconds": 45,
      "tier_cost_ceiling_usd": 400
    },
    "parent_chain": [
      "brief-REINVENTED-2026-05-14-001",
      "script-REINVENTED-2026-05-14-001",
      "storyboard-REINVENTED-2026-05-14-001"
    ],
    "metadata": {
      "agent_id": "production-coord-agent",
      "agent_version": "v1.0",
      "lock_date_iso": "2026-05-03T00:00:00Z",
      "session_id": "ars-2026-05-14-001",
      "created_at": "2026-05-14T07:30:00Z",
      "upstream_agent_ids": ["brief-agent", "script-agent", "storyboard-agent"]
    }
  },
  "brief": {
    "brief_id": "brief-REINVENTED-2026-05-14-001",
    "do_not_say": ["cheap", "discount", "sale"],
    "target_audience": "operators who lead businesses and build systems"
  },
  "storyboard": {
    "storyboard_id": "storyboard-REINVENTED-2026-05-14-001",
    "shoot_logistics": {}
  },
  "session_id": "ars-2026-05-14-001",
  "lever_state": 3,
  "engine_quota_handles": {
    "runway": "rwy-opaque-handle-001",
    "pika":   "pika-opaque-handle-001"
  },
  "cost_overrun_buffer_pct": 10,
  "runtime_environment_class": "staging"
}
